[
  {
    "item": {
      "title": "Good Will Organizations",
      "website": "https://www.goodwill.org/",
      "campaignType": "Non Profit",
      "about": "Goodwill works to enhance the dignity and quality of life of individuals and families by strengthening communities, eliminating barriers to opportunity, and helping people in need reach their full potential through learning and the power of work.",
      "objectives": "To help people find life-changing opportunities and realize their dreams. Every year, hundreds of thousands of individuals access training and career resources through Goodwill. ",
      "campaignSolution": {
        "problem": "Local Goodwill organizations are innovative and sustainable social enterprises that create job training programs, employment placement and other community-based programs",
        "supporters": "Human Resources",
        "influencers": "Pharrell Williams",
        "unique_aspects": "Direct Impact on individuals in need",
        "donor_behavior": "Preference for monthly donation",
        "upcoming_events": "World Labor Day",
        "donor_motivations": "Personal connection to cause",
        "seasonal_trends": "End of year donation"
      },
      "demographic": {
        "geographic": {
          "country": "US",
          "state": "AK",
          "city": "Anchorage"
        },
        "targetDonor": "Gen X, Baby boomers",
        "gender": "Any",
        "intention": "Events"
      },
      "timeline": "ASAP",
      "momentum": "Social media outreach",
      "strategy": "email",
      "postCampaign": "Social media polls",
      "wealthIndicator": "Owns property",
      "fundingGoals": "$198,700",
      "donorRetention": "$30",
      "commonPattern": "Supports Green Initiatives",
      "interests": "Clean Energy",
      "philanthropic_Interests": "Environmental projects",
      "recurringGiving": "Email follow up",
      "politicalAffiliation": "Democratic"
    },
    "assistantResponse": "Ideal Donor Profile for Good Will Organizations\n\nObjective and Goal:\nThe objective of this campaign is to optimize fundraising for Good Will Organizations, a non-profit organization that aims to enhance the dignity and quality of life of individuals and families by strengthening communities, eliminating barriers to opportunity, and helping people in need reach their full potential through learning and the power of work. The goal is to raise $198,700.\n\nData:\n{\"title\":\"Good Will Organizations\",\"website\":\"https://www.goodwill.org/\",\"campaignType\":\"Non Profit\",\"about\":\"Goodwill works to enhance the dignity and quality of life of individuals and families by strengthening communities, eliminating barriers to opportunity, and helping people in need reach their full potential through learning and the power of work.\",\"objectives\":\"To help people find life-changing opportunities and realize their dreams. Every year, hundreds of thousands of individuals access training and career resources through Goodwill. \",\"campaignSolution\":{\"problem\":\"Local Goodwill organizations are innovative and sustainable social enterprises that create job training programs, employment placement and other community-based programs\",\"supporters\":\"Human Resources\",\"influencers\":\"Pharrell Williams\",\"unique_aspects\":\"Direct Impact on individuals in need\",\"donor_behavior\":\"Preference for monthly donation\",\"upcoming_events\":\"World Labor Day\",\"donor_motivations\":\"Personal connection to cause\",\"seasonal_trends\":\"End of year donation\"},\"demographic\":{\"geographic\":{\"country\":\"US\",\"state\":\"AK\",\"city\":\"Anchorage\"},\"targetDonor\":\"Gen X, Baby boomers\",\"gender\":\"Any\",\"intention\":\"Events\"},\"timeline\":\"ASAP\",\"momentum\":\"Social media outreach\",\"strategy\":\"email\",\"postCampaign\":\"Social media polls\",\"wealthIndicator\":\"Owns property\",\"fundingGoals\":\"$198,700\",\"donorRetention\":\"$30\",\"commonPattern\":\"Supports Green Initiatives\",\"interests\":\"Clean Energy\",\"philanthropic_Interests\":\"Environmental projects\",\"recurringGiving\":\"Email follow up\",\"politicalAffiliation\":\"Democratic\"}\n\nData Understanding:\nGood Will Organizations is a non-profit organization that aims to enhance the dignity and quality of life of individuals and families by strengthening communities, eliminating barriers to opportunity, and helping people in need reach their full potential through learning and the power of work. The organization provides job training programs, employment placement, and other community-based programs.\n\n**Baseline Profile Creation:**\n\n* **Campaign Details:**\n\t+ Name: Good Will Organizations\n\t+ About: Goodwill works to enhance the dignity and quality of life of individuals and families by strengthening communities, eliminating barriers to opportunity, and helping people in need reach their full potential through learning and the power of work.\n\t+ Goals: To help people find life-changing opportunities and realize their dreams.\n\t+ Objectives: To provide job training programs, employment placement, and other community-based programs.\n\n* **Target Demographics:**\n\t+ Gender: Any\n\t+ Age: Gen X, Baby boomers\n\t+ Wealth: Owns property\n\n* **Location:**\n\t+ City: Anchorage\n\t+ State: AK\n\t+ Country: US\n\n**Ideal Donor Profile Development:**\n\nUsing the provided data and a conceptual formula, we will derive an 'Ideal Donor Profile' for Good Will Organizations:\n\n**Campaign Characteristics (C)**\n\n1. **C1**: Non-profit organization\n2. **C2**: Focus on job training programs, employment placement, and community-based programs\n3. **C3**: Emphasis on environmental sustainability and social responsibility\n\n**Donor Demographics (D)**\n\n1. **D1**: Gen X, Baby boomers\n2. **D2**: Owns property\n\n**Donor Behavior (B)**\n\n1. **B1**: Preference for monthly donation\n2. **B2**: Donor motivations: Personal connection to cause\n3. **B3**: Seasonal trends: End of year donation\n4. **B4**: Supports Green Initiatives\n5. **B5**: Interests: Clean Energy\n6. **B6**: Philanthropic interests: Environmental projects\n\n**Donor Personas (P)**\n\n1. **P1**: Values environmental responsibility\n2. **P2**: Communicates through email\n3. **P3**: Professional background: Works in tech industry\n4. **P4**: Supports environmental projects\n5. **P5**: Politically affiliated with the Democratic party\n6. **P6**: Has a personal connection to the cause\n7. **P7**: Prefers to donate monthly\n8. **P8**: Interested in clean energy\n9. **P9**: Supports sustainable social enterprises\n10. **P10**: Values community development\n\n**Ideal Donor Profile**\n\nBased on the analysis, the ideal donor profile for the campaign is:\n\n* **Name:** Not specified\n* **Gender:** Any\n* **Age:** Gen X, Baby boomers\n* **Wealth:** Owns property\n* **Location:** Anchorage, AK, US\n* **Interests:** Clean Energy, Environmental projects\n* **Values:** Environmental responsibility, Community development\n* **Wealth indicators:** Owns property\n* **Donation behavior:** Preference for monthly donation\n* **Communication preferences:** Email\n* **Professional background:** Works in tech industry\n* **Philanthropic interests:** Environmental projects\n* **Political affiliation:** Democratic\n\n**Targeted Outreach Strategy**\nThe targeted outreach strategy for this campaign would be to focus on Gen X and Baby boomer individuals who own property, have a personal connection to the cause, and are interested in clean energy and environmental projects. The campaign should use email as the primary communication channel and emphasize the importance of monthly donations. The campaign should also highlight the organization's focus on environmental sustainability and social responsibility.\n\n**Actionable Recommendations:**\n\n1. Use social media outreach to target Gen X and Baby boomer individuals who are interested in clean energy and environmental projects.\n2. Emphasize the importance of monthly donations and provide incentives for recurring giving.\n3. Highlight the organization's focus on environmental sustainability and social responsibility in all marketing materials.\n4. Use email as the primary communication channel and provide regular updates on the campaign's progress.\n5. Partner with local businesses and organizations to increase the campaign's reach and impact."
  }
]